{
  "tool": "run_demo",
  "ok": true,
  "exitCode": 0,
  "demoOnly": true,
  "canonical": "{\n  \"claim\": \"a spec-faithful simulated agent follows a spec-valid but false surface; the verifier catches the surface/SOR mismatch\",\n  \"actorLabel\": \"spec-faithful demonstration actor — simulated\",\n  \"simulated\": true,\n  \"specVersion\": \"taxonomy-v1+acp-extract-2026-07-02+ucp-pin-2026-04-08\",\n  \"selection\": {\n    \"intent\": \"Order the \\\"Smoked Brisket Plate\\\" if the published feed lists it as available.\",\n    \"targetTitle\": \"Smoked Brisket Plate\",\n    \"selectedItemId\": \"item-006-v1\",\n    \"selectedTitle\": \"Smoked Brisket Plate\",\n    \"observedPrice\": \"12.00\",\n    \"observedCurrency\": \"USD\",\n    \"observedAvailability\": \"in_stock\"\n  },\n  \"totalFindingCount\": 16,\n  \"beats\": [\n    {\n      \"id\": \"actor-reads\",\n      \"title\": \"The agent reads the published feed — spec-faithful demonstration actor — simulated\",\n      \"plain\": \"A shopping agent reads the published menu feed — the same data any AI assistant would consume — and never sees the restaurant's own records.\",\n      \"lines\": [\n        \"intent: Order the \\\"Smoked Brisket Plate\\\" if the published feed lists it as available.\",\n        \"source read: the published ACP feed only (no system-of-record access)\"\n      ]\n    },\n    {\n      \"id\": \"actor-selects\",\n      \"title\": \"The agent selects an item, trusting the surface\",\n      \"plain\": \"Trusting the feed at face value, the agent picks its target item and is ready to order it at the price the surface shows.\",\n      \"lines\": [\n        \"selected item: \\\"Smoked Brisket Plate\\\" (row id item-006-v1)\",\n        \"read off the surface: price 12.00 USD · availability in_stock\",\n        \"the agent is now ready to order at that price — the demo stops here (no checkout).\"\n      ],\n      \"verdicts\": [\n        {\n          \"ok\": true,\n          \"label\": \"SELECTED (from the surface)\"\n        }\n      ]\n    },\n    {\n      \"id\": \"verifier-finds\",\n      \"title\": \"The verifier checks that same copy against the records\",\n      \"plain\": \"The verifier checks the exact same feed against the restaurant's system-of-record and flags what the agent had no way to see.\",\n      \"lines\": [\n        \"1 finding for the selected item (\\\"Smoked Brisket Plate\\\"); full report: 16 findings across the whole copy.\"\n      ],\n      \"findings\": [\n        {\n          \"plainLine\": \"The served price 12.00 does not match the catalog price 10.00.\",\n          \"claimId\": \"item-006-v1#price.amount\",\n          \"claimSource\": \"acp-feed\",\n          \"claimField\": \"price.amount\",\n          \"claimValue\": \"12.00\",\n          \"referenceRowId\": \"item-006-v1\",\n          \"ruleId\": \"LST-PRICE-VALUE\",\n          \"severity\": \"error\",\n          \"category\": \"price\"\n        }\n      ],\n      \"verdicts\": [\n        {\n          \"ok\": false,\n          \"label\": \"DRIFT ON THE SELECTED ITEM — the agent could not have seen it\"\n        }\n      ]\n    },\n    {\n      \"id\": \"conformance-foil\",\n      \"title\": \"Conformance-foil: spec-valid is not the same as true\",\n      \"plain\": \"The same document passes the official schema check — it is correctly shaped — and still misstates the price versus the records.\",\n      \"lines\": [\n        \"passes the official schema check; still lies — conformance: PASS (spec-shape); truth: 1 finding(s) vs the system-of-record.\"\n      ],\n      \"findings\": [\n        {\n          \"plainLine\": \"The served price 23.50 does not match the catalog price 21.50.\",\n          \"claimId\": \"item-001-v1#price.amount\",\n          \"claimSource\": \"ucp-catalog\",\n          \"claimField\": \"price.amount\",\n          \"claimValue\": \"23.50\",\n          \"referenceRowId\": \"item-001-v1\",\n          \"ruleId\": \"LST-PRICE-VALUE\",\n          \"severity\": \"error\",\n          \"category\": \"price\"\n        }\n      ],\n      \"verdicts\": [\n        {\n          \"ok\": true,\n          \"label\": \"CONFORMANT (spec-valid)\"\n        },\n        {\n          \"ok\": false,\n          \"label\": \"FALSE vs SOR (still lies)\"\n        }\n      ]\n    }\n  ]\n}\n"
}
